{
  "lab": "Blackstone",
  "lab_number": "S000000",
  "oil_type": "Phillips XC (A/C) 20W/50",
  "report_date": "2024-02-19",
  "samples": [
    {
      "analysis_date": null,
      "elements_ppm": {
        "aluminum": 7.0,
        "barium": 0.0,
        "boron": 1.0,
        "calcium": 1.0,
        "chromium": 5.0,
        "copper": 15.0,
        "iron": 36.0,
        "lead": 1841.0,
        "magnesium": 4.0,
        "manganese": 1.0,
        "molybdenum": 0.0,
        "nickel": 1.0,
        "phosphorus": 2.0,
        "potassium": 0.0,
        "silicon": 6.0,
        "silver": 0.0,
        "sodium": 1.0,
        "tin": 1.0,
        "titanium": 0.0,
        "zinc": 4.0
      },
      "engine_hours": 518.0,
      "lab_comments": "Lorem ipsum dolor sit amet, consectetur adipiscing elit, sed do eiusmod tempor incididunt ut labore et dolore magna aliqua. Ut enim ad minim veniam, quis nostrud exercitation ullamco laboris nisi ut aliquip ex ea commodo consequat. Duis aute irure dolor in reprehenderit in voluptate velit esse cillum dolore eu fugiat nulla pariatur. Excepteur sint occaecat cupidatat non proident, sunt in culpa qui officia deserunt mollit anim id est laborum.",
      "oil_added_quarts": 5.0,
      "oil_hours": 43.0,
      "oil_properties": {
        "flashpoint_f": 445.0,
        "fuel_percent": 0.5,
        "insolubles_percent": 0.3,
        "viscosity_cst_100c": 19.24,
        "viscosity_sus_210f": 95.3,
        "water_percent": 0.0
      },
      "sample_date": "2024-01-25",
      "status": null
    },
    {
      "analysis_date": null,
      "elements_ppm": {
        "aluminum": 11.0,
        "barium": 0.0,
        "boron": 0.0,
        "calcium": 2.0,
        "chromium": 8.0,
        "copper": 13.0,
        "iron": 36.0,
        "lead": 807.0,
        "magnesium": 5.0,
        "manganese": 1.0,
        "molybdenum": 0.0,
        "nickel": 1.0,
        "phosphorus": 2.0,
        "potassium": 0.0,
        "silicon": 9.0,
        "silver": 0.0,
        "sodium": 1.0,
        "tin": 1.0,
        "titanium": 0.0,
        "zinc": 6.0
      },
      "engine_hours": 467.0,
      "lab_comments": null,
      "oil_added_quarts": 5.0,
      "oil_hours": 37.0,
      "oil_properties": {
        "flashpoint_f": 435.0,
        "fuel_percent": 0.5,
        "insolubles_percent": 0.2,
        "viscosity_cst_100c": 16.25,
        "viscosity_sus_210f": 82.9,
        "water_percent": 0.0
      },
      "sample_date": "2022-03-31",
      "status": null
    },
    {
      "analysis_date": null,
      "elements_ppm": {
        "aluminum": 10.0,
        "barium": 0.0,
        "boron": 1.0,
        "calcium": 0.0,
        "chromium": 9.0,
        "copper": 14.0,
        "iron": 40.0,
        "lead": 1045.0,
        "magnesium": 4.0,
        "manganese": 1.0,
        "molybdenum": 0.0,
        "nickel": 1.0,
        "phosphorus": 0.0,
        "potassium": 1.0,
        "silicon": 8.0,
        "silver": 0.0,
        "sodium": 2.0,
        "tin": 1.0,
        "titanium": 0.0,
        "zinc": 5.0
      },
      "engine_hours": 421.0,
      "lab_comments": null,
      "oil_added_quarts": null,
      "oil_hours": 49.0,
      "oil_properties": {
        "flashpoint_f": 460.0,
        "fuel_percent": 0.5,
        "insolubles_percent": 0.3,
        "viscosity_cst_100c": 16.85,
        "viscosity_sus_210f": 85.4,
        "water_percent": 0.0
      },
      "sample_date": "2021-08-12",
      "status": null
    },
    {
      "analysis_date": null,
      "elements_ppm": {
        "aluminum": 13.0,
        "barium": 0.0,
        "boron": 1.0,
        "calcium": 3.0,
        "chromium": 7.0,
        "copper": 16.0,
        "iron": 161.0,
        "lead": 2139.0,
        "magnesium": 5.0,
        "manganese": 2.0,
        "molybdenum": 1.0,
        "nickel": 1.0,
        "phosphorus": 1.0,
        "potassium": 0.0,
        "silicon": 9.0,
        "silver": 0.0,
        "sodium": 2.0,
        "tin": 5.0,
        "titanium": 0.0,
        "zinc": 4.0
      },
      "engine_hours": null,
      "lab_comments": null,
      "oil_added_quarts": 3.0,
      "oil_hours": 30.0,
      "oil_properties": {
        "flashpoint_f": 475.0,
        "fuel_percent": 0.5,
        "insolubles_percent": 0.3,
        "viscosity_cst_100c": 18.89,
        "viscosity_sus_210f": 93.8,
        "water_percent": 0.0
      },
      "sample_date": "2020-06-08",
      "status": null
    },
    {
      "analysis_date": null,
      "elements_ppm": {
        "aluminum": 19.0,
        "barium": 0.0,
        "boron": 0.0,
        "calcium": 0.0,
        "chromium": 6.0,
        "copper": 15.0,
        "iron": 818.0,
        "lead": 692.0,
        "magnesium": 12.0,
        "manganese": 6.0,
        "molybdenum": 1.0,
        "nickel": 2.0,
        "phosphorus": 8.0,
        "potassium": 0.0,
        "silicon": 7.0,
        "silver": 0.0,
        "sodium": 1.0,
        "tin": 6.0,
        "titanium": 0.0,
        "zinc": 4.0
      },
      "engine_hours": 293.0,
      "lab_comments": null,
      "oil_added_quarts": 0.0,
      "oil_hours": 4.0,
      "oil_properties": {
        "flashpoint_f": 490.0,
        "fuel_percent": 0.5,
        "insolubles_percent": 0.4,
        "viscosity_cst_100c": 18.63,
        "viscosity_sus_210f": 92.7,
        "water_percent": 0.0
      },
      "sample_date": "2019-12-30",
      "status": null
    }
  ],
  "tail_number": "N0000X"
}
